<?xml version="1.0" encoding="utf-8"?>
<Game1 xmlns:xsi="http://www.w3.org/2001/XMLSchema-instance" 
       xsi:noNamespaceSchemaLocation="../xsd/Init_Game.xsd">
    <pacman>
        <rotation>hhhhhh</rotation>
        <animationInterval>0.5</animationInterval>
    </pacman>
    <carte>
        <map>
            <ligne>0 0 0 0 0 0 0 0 0 0 0 0 0</ligne>
            <ligne>0 1 1 1 1 1 1 1 1 1 1 1 1</ligne>
            <ligne>0 1 0 0 0 0 0 0 0 0 0 1 1</ligne>
            <ligne>0 1 1 1 1 1 1 1 1 1 1 1 1</ligne>
            <ligne>0 1 0 0 0 0 0 0 0 0 0 1 1</ligne>
            <ligne>0 1 1 1 1 1 1 1 1 1 1 1 1</ligne>
            <ligne>0 1 0 0 0 0 0 0 0 0 0 1 1</ligne>
            <ligne>0 1 1 1 1 1 1 1 1 1 1 1 1</ligne>
            <ligne>0 1 0 0 0 0 0 0 0 0 0 1 1</ligne>
            <ligne>0 1 1 1 1 1 1 1 1 1 1 1 1</ligne>
            <ligne>0 1 0 0 0 0 0 0 0 0 0 1 1</ligne>
            <ligne>0 1 1 1 1 1 1 1 1 1 1 1 1</ligne>
            <ligne>0 1 0 0 0 0 0 0 0 0 0 1 1</ligne>
            <ligne>0 0 0 0 0 0 0 0 0 0 0 0 1</ligne>
        </map>
        <taille>50</taille
    </carte>



    <ghosts>

        <direction>
            <x>1</x>
            <y>0</y>
        </direction>
        <speed>1</speed>
    </ghosts>
    
    <points>
        <position>
            <x>0</x>
            <y>1</y>
        </position>
        <size> 1</size>
    </points>
    
    <grille>
        <ligne>1</ligne>
    </grille>
    <taille>50</taille>
    <state>playing</state>
    <SelectOption> 0</SelectOption>
    <gameOverOption>0</gameOverOption>
</Game1>
